{
  "$schema": "https://json-schema.org/draft/2020-12/schema",
  "$id": "https://github.com/zhangbeimiao/TraceRepair/blob/main/docs/benchmark-manifest.schema.json",
  "title": "TraceRepair historical pass@1 benchmark",
  "type": "object",
  "additionalProperties": false,
  "required": [
    "schema_version",
    "benchmark_id",
    "agent_version",
    "model",
    "protocol",
    "tasks"
  ],
  "properties": {
    "$schema": {"type": "string"},
    "schema_version": {"const": 1},
    "benchmark_id": {
      "type": "string",
      "pattern": "^[a-z0-9][a-z0-9.-]{2,63}$"
    },
    "agent_version": {"type": "string", "minLength": 1, "maxLength": 64},
    "model": {"type": "string", "minLength": 1, "maxLength": 100},
    "protocol": {"const": "pass@1"},
    "completion_cny_per_million_tokens": {
      "type": "number",
      "minimum": 0
    },
    "retrieval": {
      "type": "object",
      "additionalProperties": false,
      "required": [
        "mode",
        "chunker_version",
        "embedding_model",
        "embedding_dimensions",
        "top_k",
        "rrf_k"
      ],
      "properties": {
        "mode": {"enum": ["fts5", "hybrid"]},
        "chunker_version": {"type": "string", "minLength": 1, "maxLength": 60},
        "embedding_model": {"type": ["string", "null"], "maxLength": 100},
        "embedding_dimensions": {"enum": [null, 256, 512, 768, 1024]},
        "top_k": {"type": "integer", "minimum": 1, "maximum": 10},
        "rrf_k": {"type": "integer", "minimum": 1, "maximum": 1000}
      }
    },
    "contracts": {
      "type": "object",
      "additionalProperties": false,
      "required": [
        "agent_config_sha256",
        "prompt_protocol_sha256",
        "prompt_security_sha256",
        "retrieval_gate_sha256"
      ],
      "properties": {
        "agent_config_sha256": {"type": "string", "pattern": "^[0-9a-f]{64}$"},
        "prompt_protocol_sha256": {"type": "string", "pattern": "^[0-9a-f]{64}$"},
        "prompt_security_sha256": {"type": "string", "pattern": "^[0-9a-f]{64}$"},
        "retrieval_gate_sha256": {"type": "string", "pattern": "^[0-9a-f]{64}$"}
      }
    },
    "tasks": {
      "type": "array",
      "minItems": 2,
      "maxItems": 50,
      "items": {
        "type": "object",
        "additionalProperties": false,
        "required": ["id", "split", "task_config", "source"],
        "properties": {
          "id": {
            "type": "string",
            "pattern": "^[a-z0-9][a-z0-9-]{1,63}$"
          },
          "split": {"enum": ["development", "locked"]},
          "task_config": {"type": "string", "minLength": 1, "maxLength": 500},
          "source": {
            "type": "object",
            "additionalProperties": false,
            "required": ["repository_url", "buggy_commit", "fixed_commit"],
            "properties": {
              "repository_url": {
                "type": "string",
                "pattern": "^https://github\\.com/"
              },
              "buggy_commit": {"type": "string", "pattern": "^[0-9a-f]{40}$"},
              "fixed_commit": {"type": "string", "pattern": "^[0-9a-f]{40}$"},
              "issue_url": {
                "type": "string",
                "pattern": "^https://github\\.com/"
              }
            }
          }
        }
      }
    }
  }
}
